{
  "asset_class": "prop_small",
  "export": {
    "file_version": "FBX202000",
    "format": "fbx-ascii",
    "settings_version": 1,
    "unit_scale_cm": 1.0,
    "up_axis": "y"
  },
  "exported_from": {
    "path": "out/unity_fixtures/fixed/SM_Messy.ma",
    "sha256": "1b72d9a7f8511fe56e62e6ed252d432d91197ea2e1ec1cf9fadd8dca0c62767a"
  },
  "fixed_from": null,
  "fixes": [],
  "results": [
    {
      "fixable": false,
      "id": "scene.has_meshes",
      "message": "1 mesh(es) found",
      "metrics": {
        "mesh_count": 1
      },
      "offender_count": 0,
      "offenders": [],
      "passed": true,
      "severity": "error"
    },
    {
      "fixable": false,
      "id": "topology.non_manifold",
      "message": "no non-manifold geometry",
      "metrics": {
        "meshes_affected": 0,
        "nonmanifold_edges": 0,
        "nonmanifold_vertices": 0
      },
      "offender_count": 0,
      "offenders": [],
      "passed": true,
      "severity": "error"
    },
    {
      "fixable": true,
      "id": "topology.lamina_faces",
      "message": "no lamina faces",
      "metrics": {
        "lamina_faces": 0,
        "meshes_affected": 0
      },
      "offender_count": 0,
      "offenders": [],
      "passed": true,
      "severity": "error"
    },
    {
      "fixable": false,
      "id": "topology.open_borders",
      "message": "all meshes are watertight",
      "metrics": {
        "border_edges": 0,
        "meshes_affected": 0
      },
      "offender_count": 0,
      "offenders": [],
      "passed": true,
      "severity": "error"
    },
    {
      "fixable": true,
      "id": "topology.inverted",
      "message": "no inverted meshes",
      "metrics": {
        "inward": 0,
        "meshes": {},
        "meshes_checked": 1,
        "not_verifiable": 0,
        "opposite_flag": 0
      },
      "offender_count": 0,
      "offenders": [],
      "passed": true,
      "severity": "error"
    },
    {
      "fixable": false,
      "id": "topology.ngons",
      "message": "no ngons",
      "metrics": {
        "max_sides": 0,
        "meshes_affected": 0,
        "ngons": 0
      },
      "offender_count": 0,
      "offenders": [],
      "passed": true,
      "severity": "error"
    },
    {
      "fixable": false,
      "id": "budget.tris",
      "message": "LOD0 has 12 tris, 2% of the prop_small budget (500)",
      "metrics": {
        "lod0_tris": 12,
        "percent_of_budget": 2.4,
        "total_tris_all_lods": 12,
        "tris_max": 500
      },
      "offender_count": 0,
      "offenders": [],
      "passed": true,
      "severity": "error"
    },
    {
      "fixable": false,
      "id": "budget.lods",
      "message": "1 LOD level(s), all within budget",
      "metrics": {
        "levels": 1,
        "lods_max": 1,
        "lods_min": 1,
        "max_tris_per_level": {},
        "tris_per_level": {
          "LOD0": 12
        }
      },
      "offender_count": 0,
      "offenders": [],
      "passed": true,
      "severity": "error"
    },
    {
      "fixable": false,
      "id": "budget.materials",
      "message": "all meshes within 1 material(s)",
      "metrics": {
        "materials_per_mesh": {
          "|SM_Messy": [
            "M_Messy"
          ]
        },
        "max_found": 1,
        "max_materials": 1,
        "unassigned_faces": 0
      },
      "offender_count": 0,
      "offenders": [],
      "passed": true,
      "severity": "error"
    },
    {
      "fixable": true,
      "id": "uv.present",
      "message": "all meshes have UV sets ['map1'] mapping every face",
      "metrics": {
        "meshes_missing_sets": 0,
        "meshes_wrong_order": 0,
        "required_sets": [
          "map1"
        ],
        "unmapped_faces": 0,
        "uv_sets_per_mesh": {
          "|SM_Messy": [
            "map1"
          ]
        }
      },
      "offender_count": 0,
      "offenders": [],
      "passed": true,
      "severity": "error"
    },
    {
      "fixable": false,
      "id": "uv.unit_square",
      "message": "all map1 UVs inside 0-1",
      "metrics": {
        "faces_outside": 0,
        "meshes_skipped": 0,
        "required": true,
        "u_max": 1.0,
        "u_min": 0.0,
        "v_max": 1.0,
        "v_min": 0.0
      },
      "offender_count": 0,
      "offenders": [],
      "passed": true,
      "severity": "error"
    },
    {
      "fixable": false,
      "id": "uv.overlap",
      "message": "no overlapping map1 faces",
      "metrics": {
        "meshes_affected": 0,
        "meshes_skipped": 0,
        "overlap_allowed": true,
        "overlapping_faces": 0
      },
      "offender_count": 0,
      "offenders": [],
      "passed": true,
      "severity": "info"
    },
    {
      "fixable": true,
      "id": "scene.units",
      "message": "not verifiable for FBX yet (backlog #4); transform.size still catches unit mistakes",
      "metrics": {
        "expected": "cm",
        "verified": false
      },
      "offender_count": 0,
      "offenders": [],
      "passed": true,
      "severity": "warning"
    },
    {
      "fixable": true,
      "id": "transform.frozen",
      "message": "all 1 transform frozen",
      "metrics": {
        "negative_scale": 0,
        "not_frozen": 0,
        "transforms_checked": 1,
        "values": {}
      },
      "offender_count": 0,
      "offenders": [],
      "passed": true,
      "severity": "error"
    },
    {
      "fixable": true,
      "id": "transform.pivot",
      "message": "pivots at origin, geometry placed for bottom_center mode",
      "metrics": {
        "anchor_cm": [
          0.0,
          0.0,
          0.0
        ],
        "anchor_offset_cm": 0.0,
        "bbox_max_cm": [
          42.426403,
          60.000004,
          42.426403
        ],
        "bbox_min_cm": [
          -42.426403,
          0.0,
          -42.426403
        ],
        "mode": "bottom_center",
        "pivots_off_origin": {},
        "tolerance_cm": 0.5
      },
      "offender_count": 0,
      "offenders": [],
      "passed": true,
      "severity": "error"
    },
    {
      "fixable": false,
      "id": "transform.size",
      "message": "largest dimension 84.9 cm, within 5-150 cm for prop_small",
      "metrics": {
        "dimensions_cm": [
          84.852806,
          60.000004,
          84.852806
        ],
        "largest_cm": 84.852806,
        "size_cm_max": 150.0,
        "size_cm_min": 5.0,
        "unit_guess": null
      },
      "offender_count": 0,
      "offenders": [],
      "passed": true,
      "severity": "error"
    },
    {
      "fixable": true,
      "id": "naming.convention",
      "message": "names and hierarchy follow the convention",
      "metrics": {
        "file_stem": "SM_Messy",
        "materials": [
          "M_Messy"
        ],
        "problems": {}
      },
      "offender_count": 0,
      "offenders": [],
      "passed": true,
      "severity": "error"
    },
    {
      "fixable": true,
      "id": "scene.history",
      "message": "no construction history",
      "metrics": {
        "history_nodes": {},
        "meshes_with_history": 0
      },
      "offender_count": 0,
      "offenders": [],
      "passed": true,
      "severity": "error"
    }
  ],
  "schema_version": "1.2",
  "source": {
    "path": "unity/Packages/com.artpipe.importer/Tests/Editor/Fixtures~/SM_Messy.fbx",
    "sha256": "d15cc1394a149a81509c1d9ef864978e6b4c5490d035d172d3e2e700719b99e1"
  },
  "status": "pass",
  "summary": {
    "errors": 0,
    "fixable": 0,
    "fixes_applied": 0,
    "passed": 18,
    "total": 18,
    "warnings": 0
  },
  "tool": "artpipe.validate.maya",
  "tool_error": null
}
